{
  "schema_version": "1.1",
  "world_id": "T1-HW-20260728-B",
  "evaluation_step": 2,
  "method_id": "isolated-local-holder-v1",
  "decisions": [
    {
      "detection_id": "QUARTZ-11-ABSENT-STEP-2",
      "kind": "CLAIM",
      "state": "ABSENT",
      "claim_key": "HWB-CLOSED-NEG-QUARTZ",
      "subject": "QUARTZ-11",
      "evidence_refs": [
        "W-HWB-CLOSED-QUARTZ-NEG"
      ]
    }
  ],
  "probes": [],
  "disclosures": [],
  "projection_updates": [],
  "relation_handoffs": []
}
